{
  "$schema": "https://json-schema.org/draft/2020-12/schema",
  "$id": "https://gt-editorial-schema.local/schemas/export_bundle.schema.json",
  "title": "Editorial Export Bundle",
  "description": "Portable bundle for moving editorial entities, relationships, sources, Phase 1 editorial objects, and taxonomy metadata between systems.",
  "type": "object",
  "additionalProperties": false,
  "required": ["schema_version", "generated_by", "generated_at", "entities"],
  "properties": {
    "schema_version": {
      "type": "string",
      "pattern": "^\\d+\\.\\d+\\.\\d+$"
    },
    "generated_by": {
      "type": "string",
      "description": "Project or process that produced the bundle."
    },
    "generated_at": {
      "type": "string",
      "format": "date-time"
    },
    "taxonomy_version": {
      "type": "string"
    },
    "entities": {
      "type": "array",
      "items": {
        "$ref": "./entities.schema.json"
      },
      "default": []
    },
    "editorial_entities": {
      "type": "array",
      "description": "Phase 1 alias for reusable editorial entities. Compatible with entities.",
      "items": {
        "$ref": "./entities.schema.json"
      },
      "default": []
    },
    "relationships": {
      "type": "array",
      "items": {
        "$ref": "./relationships.schema.json"
      },
      "default": []
    },
    "sources": {
      "type": "array",
      "items": {
        "$ref": "./source.schema.json"
      },
      "default": []
    },
    "source_refs": {
      "type": "array",
      "description": "Phase 1 alias for verifiable source references. Compatible with sources.",
      "items": {
        "$ref": "./source.schema.json"
      },
      "default": []
    },
    "source_packets": {
      "type": "array",
      "items": {
        "$ref": "./editorial_objects.schema.json"
      },
      "default": []
    },
    "evidence_items": {
      "type": "array",
      "items": {
        "$ref": "./editorial_objects.schema.json"
      },
      "default": []
    },
    "editorial_requirements": {
      "type": "array",
      "items": {
        "$ref": "./editorial_objects.schema.json"
      },
      "default": []
    },
    "content_blocks": {
      "type": "array",
      "items": {
        "$ref": "./editorial_objects.schema.json"
      },
      "default": []
    },
    "skeleton_decisions": {
      "type": "array",
      "items": {
        "$ref": "./editorial_objects.schema.json"
      },
      "default": []
    },
    "freshness_signals": {
      "type": "array",
      "items": {
        "$ref": "./editorial_objects.schema.json"
      },
      "default": []
    },
    "reusable_notes": {
      "type": "array",
      "items": {
        "$ref": "./editorial_objects.schema.json"
      },
      "default": []
    },
    "audit_logs": {
      "type": "array",
      "items": {
        "$ref": "./editorial_objects.schema.json"
      },
      "default": []
    },
    "learning_packs": {
      "type": "array",
      "items": {
        "$ref": "./learning_pack.schema.json"
      },
      "default": []
    }
  }
}
